{
  "contribution": {
    "agent": "Claude (Cowork)",
    "model": "Claude Fable 5 (claude-fable-5)",
    "start": "2026-08-02 21:56 UTC",
    "end": "2026-08-02 21:56 UTC",
    "procedure": "Director contribution-tagging procedure (docs/decisions/0006)."
  },
  "$comment": "ROADMAP Phase 1A step 1 - the canonical combat-state definitions. Engine-neutral: the Unreal sandbox implements exactly this machine (Rule 22 / Decision 0002). One machine set for every player, mode and CPU fighter (Rule 5). Definitions only - no simulation code or engine implementation is claimed (Rule 18). Semantics: docs/phase1a/combat_state_definitions.md.",
  "schema_version": "0.1.0-draft",
  "tuning_status": "hypothesis",
  "allowed_input_domains": [
    "own_condition",
    "opponent_observables",
    "observable_event_log",
    "authoritative_clock_observable",
    "count_observable",
    "referee_instructions_observable",
    "crowd_observable",
    "range_and_position_observable",
    "move_data_authored"
  ],
  "forbidden_input_domains": [
    "official_scorecards",
    "sealed_events",
    "opponent_raw_inputs",
    "privileged_rng",
    "hidden_difficulty_state"
  ],
  "machines": {
    "match_flow": {
      "$comment": "Owned by the authoritative Match Controller. Segments mirror fight_event clock.segment. Decision assembly reads sealed judge cards inside the controller only; partial cards stay sealed through the immediate result flow (Rule 3).",
      "initial": "pre_bout",
      "states": [
        {
          "id": "pre_bout",
          "description": "Entrances, referee disclosure (Rule 16), fighter presentation. No combat resolution.",
          "clock_segment": "entrance"
        },
        {
          "id": "round_active",
          "description": "A round is live. The authoritative fight clock runs; all systems read it (Rule 9).",
          "clock_segment": "round"
        },
        {
          "id": "between_rounds",
          "description": "30 real-second break. Menu and statistics access do not pause the countdown (Rule 9).",
          "clock_segment": "break",
          "duration_source": "authoritative_clock"
        },
        {
          "id": "knockdown_count",
          "description": "A fighter is down. The universal knockdown-count clock runs, referee-synchronized (Rule 16).",
          "clock_segment": "count",
          "duration_source": "authoritative_clock"
        },
        {
          "id": "doctor_check_hold",
          "description": "Referee-initiated medical inspection under universal medical minimums (Rule 16). Eye and cut condition feed doctor confidence (Rule 14).",
          "clock_segment": "doctor_check"
        },
        {
          "id": "post_fight",
          "description": "Result, quick menu, statistics. Official cards remain sealed during this immediate flow; optional archival reveal comes later (Rule 3).",
          "clock_segment": "post_fight"
        },
        {
          "id": "bout_complete",
          "description": "Terminal. The authoritative event log is closed and becomes replay evidence (sandbox criteria E.19-E.21).",
          "terminal": true
        }
      ],
      "transitions": [
        {
          "id": "open_bout",
          "from": "pre_bout",
          "to": "round_active",
          "trigger_kind": "authoritative_clock",
          "trigger_detail": "entrance sequence complete; first bell",
          "emits": [
            "bout_start",
            "round_start"
          ]
        },
        {
          "id": "round_expires",
          "from": "round_active",
          "to": "between_rounds",
          "trigger_kind": "authoritative_clock",
          "trigger_detail": "round clock reaches zero and the scheduled bout continues",
          "emits": [
            "round_end",
            "break_start"
          ]
        },
        {
          "id": "break_expires",
          "from": "between_rounds",
          "to": "round_active",
          "trigger_kind": "authoritative_clock",
          "trigger_detail": "30 real seconds elapse, or an in-match dual-consent skip (Rule 9)",
          "emits": [
            "break_end",
            "round_start"
          ]
        },
        {
          "id": "knockdown_interrupt",
          "from": "round_active",
          "to": "knockdown_count",
          "trigger_kind": "incoming_contact",
          "trigger_detail": "a fighter_action machine enters knocked_down",
          "emits": [
            "count_tick"
          ]
        },
        {
          "id": "count_resolved_continue",
          "from": "knockdown_count",
          "to": "round_active",
          "trigger_kind": "count_clock",
          "trigger_detail": "rise accepted before ten plus mandatory referee look (universal minimums, Rule 16)",
          "emits": []
        },
        {
          "id": "count_resolved_stop",
          "from": "knockdown_count",
          "to": "post_fight",
          "trigger_kind": "count_clock",
          "trigger_detail": "count reaches ten, or referee waves off during the count",
          "emits": [
            "stoppage",
            "bout_end"
          ]
        },
        {
          "id": "doctor_hold",
          "from": "round_active",
          "to": "doctor_check_hold",
          "trigger_kind": "referee",
          "trigger_detail": "referee pauses action for medical inspection",
          "emits": [
            "doctor_check"
          ]
        },
        {
          "id": "doctor_continue",
          "from": "doctor_check_hold",
          "to": "round_active",
          "trigger_kind": "referee",
          "trigger_detail": "doctor confidence sufficient to continue",
          "emits": []
        },
        {
          "id": "doctor_stop",
          "from": "doctor_check_hold",
          "to": "post_fight",
          "trigger_kind": "referee",
          "trigger_detail": "doctor stoppage",
          "emits": [
            "stoppage",
            "bout_end"
          ]
        },
        {
          "id": "final_round_end",
          "from": "round_active",
          "to": "post_fight",
          "trigger_kind": "authoritative_clock",
          "trigger_detail": "last scheduled round expires; decision assembled from sealed cards by the Match Controller only (Rule 3)",
          "emits": [
            "round_end",
            "bout_end"
          ]
        },
        {
          "id": "stoppage_end",
          "from": "round_active",
          "to": "post_fight",
          "trigger_kind": "referee",
          "trigger_detail": "in-round stoppage: waved off, failure to intelligently defend, disqualification, or corner retirement at the bell",
          "emits": [
            "stoppage",
            "bout_end"
          ]
        },
        {
          "id": "close_bout",
          "from": "post_fight",
          "to": "bout_complete",
          "trigger_kind": "authoritative_clock",
          "trigger_detail": "post-fight flow complete; log sealed as replay evidence",
          "emits": []
        }
      ]
    },
    "fighter_action": {
      "$comment": "One per fighter, identical for human and CPU control (Rule 5). Action phases bind to move data: startup_frames, active_frames, recovery_frames from data/moves (Rule 22). CPU policies read only allowed_input_domains (Rule 3).",
      "initial": "idle",
      "states": [
        {
          "id": "idle",
          "description": "Uncommitted. Full action availability; the posture continuum governs locomotion in parallel.",
          "duration_source": "sustained",
          "availability": {
            "can_punch": true,
            "can_guard": true,
            "can_evade": true,
            "can_move": true
          }
        },
        {
          "id": "move_startup",
          "description": "Committed to a move; startup_frames from move data. Commitment is real: no cancel to idle after commit (Rule 13 explicit commitment). Interruptible by incoming contact.",
          "duration_source": "move_data",
          "counter_open": true,
          "move_categories": [
            "jab",
            "cross",
            "hook",
            "uppercut",
            "overhand",
            "body_shot",
            "guard",
            "evasion",
            "step",
            "pivot",
            "clinch",
            "showmanship"
          ],
          "availability": {
            "can_punch": false,
            "can_guard": false,
            "can_evade": false,
            "can_move": false
          },
          "notes": "Startup interception is the first counter window (Rule 22: counterplay from the first punch)."
        },
        {
          "id": "move_active",
          "description": "Active window; active_frames from move data. Offensive categories resolve contact into the seven classes of data/contact_classes.json; evasion categories classify incoming punches as dodged; guard categories transition to guard_hold.",
          "duration_source": "move_data",
          "availability": {
            "can_punch": false,
            "can_guard": false,
            "can_evade": false,
            "can_move": false
          }
        },
        {
          "id": "move_recovery",
          "description": "Post-action vulnerability; recovery_frames from move data, scaled by the commitment tier of the outcome. The deepest counter window.",
          "duration_source": "move_data",
          "counter_open": true,
          "consequence_scaling": "contact_class_commitment_tier",
          "condition_refs": [
            "stamina"
          ],
          "availability": {
            "can_punch": false,
            "can_guard": false,
            "can_evade": false,
            "can_move": false
          },
          "notes": "Rule 13: blocked < dodged < whiffed strictly increasing recovery and stamina consequence. Numerical ratios are tuning hypotheses."
        },
        {
          "id": "guard_hold",